{
  "$schema": "./jira-seed.schema.json",
  "version": "2026-09-16",
  "project": {
    "key": "SCRUM",
    "name": "Agentic QA Automation — course backlog",
    "type": "team-managed",
    "template": "scrum"
  },
  "source": {
    "site": "codemify-qa-ai.atlassian.net (the course's reference project)",
    "snapshot": "2026-09-16",
    "workItems": 158,
    "keys": "SCRUM-5..162 on the source; SCRUM-1..4 were deleted template samples, so the seeder burns those four numbers",
    "reconciled": [
      "SCRUM-8 description: 'Zephyr result writeback' → 'case result writeback' (the course dropped Zephyr, BUILD-LOG 021)",
      "SCRUM-24 summary/description: 'Zephyr execution writeback' → 'Test-result writeback' (same reason; the source project still carries the stale title)"
    ]
  },
  "placeholders": {
    "count": 4,
    "why": "Jira never reuses a number. The source project's keys start at 5, so on an empty space four throwaway items are created and deleted first."
  },
  "epics": [
    {
      "courseKey": "SCRUM-5",
      "summary": "UI test automation: Playwright suite for the sandbox web app",
      "description": "**Description:** Build and maintain the Playwright UI suite covering environment identity, auth, public blog, article lifecycle, categories, and account settings, against dev (full) and prod (read-only smoke). Locators must use data-testid; mutating specs gated to dev via runIfEnv/envGuard.\n**Definition of done:** all P1/P2 UI cases automated, green on dev; prod smoke subset green; suites run headless in CI.",
      "labels": [
        "qa-automation",
        "ui"
      ],
      "priority": "Medium",
      "tasks": [
        {
          "courseKey": "SCRUM-9",
          "summary": "Automate environment & navigation smoke (UI)",
          "description": "**Description:** Verify the environment banner identifies dev vs prod, and navigation renders correctly for anonymous vs authenticated users.\n**Acceptance criteria:**\n\n* Banner asserts DEVELOPMENT on dev and PRODUCTION on prod (TC-UI-001, 002)\n* Anonymous nav shows login only; authed nav shows dashboard/categories/account/logout (TC-UI-003, 004)\n* Runs green in both APP_ENV modes; no mutations.\n  **Covers:** TC-UI-001..004",
          "labels": [
            "qa-automation",
            "ui"
          ],
          "priority": "Medium",
          "tc": [
            "TC-UI-001",
            "TC-UI-002",
            "TC-UI-003",
            "TC-UI-004"
          ],
          "subtasks": [
            {
              "courseKey": "SCRUM-108",
              "summary": "TC-UI-001 — Environment banner shows DEVELOPMENT on the dev target",
              "description": "Automated: tests/blog/ui/ui-smoke.spec.ts. Asserts env-banner is visible and article cards render on the homepage. Runs dev + prod (banner text differs by APP_ENV). Tag: @smoke.",
              "labels": [
                "automated",
                "blog",
                "env-dev-prod",
                "ui"
              ],
              "priority": "Medium",
              "tc": "TC-UI-001"
            },
            {
              "courseKey": "SCRUM-109",
              "summary": "TC-UI-003 — Anonymous nav shows login; authed links are absent",
              "description": "Automated: tests/blog/ui/blog-auth-nav.spec.ts. Guest sees nav-home + nav-login; nav-dashboard, nav-logout, nav-account must not render. Read-only, runs dev + prod.",
              "labels": [
                "automated",
                "blog",
                "env-dev-prod",
                "ui"
              ],
              "priority": "Medium",
              "tc": "TC-UI-003"
            },
            {
              "courseKey": "SCRUM-110",
              "summary": "TC-UI-004 — Authenticated nav shows dashboard/categories/account/logout; login absent",
              "description": "Automated: tests/blog/ui/blog-auth-nav.spec.ts. Uses the worker-scoped authedPage fixture. Read-only, runs dev + prod.",
              "labels": [
                "automated",
                "blog",
                "env-dev-prod",
                "ui"
              ],
              "priority": "Medium",
              "tc": "TC-UI-004"
            }
          ]
        },
        {
          "courseKey": "SCRUM-10",
          "summary": "Automate web login/logout & access control (UI)",
          "description": "**Description:** Cover the credential login flow, failure states, logout, and redirects on protected pages.\n**Acceptance criteria:**\n\n* Valid login lands on dashboard; wrong password and unknown email show login-error without revealing account existence (TC-UI-010..012)\n* Logout clears session; protected routes redirect anonymous users to /login (TC-UI-013, 014)\n  **Covers:** TC-UI-010..014",
          "labels": [
            "auth",
            "qa-automation",
            "ui"
          ],
          "priority": "Medium",
          "tc": [
            "TC-UI-010",
            "TC-UI-011",
            "TC-UI-012",
            "TC-UI-013",
            "TC-UI-014"
          ],
          "subtasks": [
            {
              "courseKey": "SCRUM-111",
              "summary": "TC-UI-010 — Login succeeds with valid author credentials and reaches the dashboard",
              "description": "Automated: tests/blog/ui/ui-smoke.spec.ts and blog-auth-nav.spec.ts. Asserts dashboard-table renders after form login. Tag: @smoke.",
              "labels": [
                "automated",
                "blog",
                "env-dev-prod",
                "ui"
              ],
              "priority": "Medium",
              "tc": "TC-UI-010"
            },
            {
              "courseKey": "SCRUM-112",
              "summary": "TC-UI-011 — Login fails with a wrong password and shows login-error",
              "description": "Automated: tests/blog/ui/ui-smoke.spec.ts. Read-only, runs dev + prod.",
              "labels": [
                "automated",
                "blog",
                "env-dev-prod",
                "ui"
              ],
              "priority": "Medium",
              "tc": "TC-UI-011"
            },
            {
              "courseKey": "SCRUM-113",
              "summary": "TC-UI-012 — Login fails with an unknown email without revealing the account",
              "description": "Automated: tests/blog/ui/blog-auth-nav.spec.ts. Asserts the error message does not disclose whether the email exists (no account enumeration). Read-only, dev + prod.",
              "labels": [
                "automated",
                "blog",
                "env-dev-prod",
                "ui"
              ],
              "priority": "Medium",
              "tc": "TC-UI-012"
            },
            {
              "courseKey": "SCRUM-114",
              "summary": "TC-UI-013 — Logout ends the session and re-protects the dashboard",
              "description": "Automated: tests/blog/ui/blog-auth-nav.spec.ts. After nav-logout the guest nav returns and /dashboard redirects to /login. Read-only, dev + prod.",
              "labels": [
                "automated",
                "blog",
                "env-dev-prod",
                "ui"
              ],
              "priority": "Medium",
              "tc": "TC-UI-013"
            },
            {
              "courseKey": "SCRUM-115",
              "summary": "TC-UI-014 — Protected pages redirect an anonymous visitor to /login",
              "description": "Automated: tests/blog/ui/blog-auth-nav.spec.ts. Covers /dashboard, /articles/new, /account, /categories. Read-only, dev + prod.",
              "labels": [
                "automated",
                "blog",
                "env-dev-prod",
                "ui"
              ],
              "priority": "Medium",
              "tc": "TC-UI-014"
            }
          ]
        },
        {
          "courseKey": "SCRUM-11",
          "summary": "Automate public blog list: listing, search, filter, pagination, empty state (UI)",
          "description": "**Acceptance criteria:**\n\n* Published-only listing with correct card anatomy (TC-UI-020, 021)\n* Search narrows results and shows empty-state on no match (TC-UI-022, 023)\n* Category filter and pagination behave per spec (TC-UI-024, 025)\n  **Covers:** TC-UI-020..025",
          "labels": [
            "qa-automation",
            "ui"
          ],
          "priority": "Medium",
          "tc": [
            "TC-UI-020",
            "TC-UI-021",
            "TC-UI-022",
            "TC-UI-023",
            "TC-UI-024",
            "TC-UI-025"
          ],
          "subtasks": [
            {
              "courseKey": "SCRUM-116",
              "summary": "TC-UI-020 — Homepage lists published articles with author and category",
              "description": "Automated: tests/blog/ui/ui-smoke.spec.ts. Asserts article-list and article-card render. Read-only, dev + prod. Tag: @smoke.",
              "labels": [
                "automated",
                "blog",
                "env-dev-prod",
                "ui"
              ],
              "priority": "Medium",
              "tc": "TC-UI-020"
            },
            {
              "courseKey": "SCRUM-117",
              "summary": "TC-UI-021 — A draft article never appears on the public list",
              "description": "Automated: tests/blog/ui/blog-list.spec.ts. The UI-side guard for the same privacy rule api-articles.spec.ts asserts at the API. Uses seeded draft article 7. Read-only, dev + prod. Tags: @smoke @regression.",
              "labels": [
                "automated",
                "blog",
                "env-dev-prod",
                "ui"
              ],
              "priority": "Medium",
              "tc": "TC-UI-021"
            },
            {
              "courseKey": "SCRUM-118",
              "summary": "TC-UI-022 — Search filters the article list",